{"$id":"hardcover-synthetic-durable-work-input-v4","$schema":"https://json-schema.org/draft/2020-12/schema","additionalProperties":false,"properties":{"failure_points":{"items":{"enum":["migration_statement","publication_before_commit","restart_after_start","stale_fence"]},"maxItems":4,"type":"array","uniqueItems":true},"scenario":{"const":"durable-work-v3"},"schema":{"const":"hardcover-synthetic-input-v3"},"script":{"items":{"additionalProperties":false,"properties":{"candidate":{"minimum":1,"type":"integer"},"fence":{"minimum":1,"type":"integer"},"op":{"enum":["regenerate_schema8","verify_snapshot","apply_migration9","verify_migration9_idempotence","accept","gate_acquire","claim","renew_start","socket_close","publish","gate_release","wait","restart","recover","read_current","expire_current"]},"process":{"maxLength":32,"type":"string"},"result":{"maxLength":64,"type":"string"},"wall_us":{"minimum":0,"type":"integer"}},"required":["op","wall_us"],"type":"object"},"maxItems":64,"minItems":1,"type":"array"}},"required":["schema","scenario","failure_points","script"],"type":"object"}
