{"failure_points":["migration_statement","publication_before_commit","restart_after_start","stale_fence"],"scenario":"durable-work-v3","schema":"hardcover-synthetic-input-v3","script":[{"op":"regenerate_schema8","process":"preview","result":"exact-prefix-1-through-8","wall_us":0},{"op":"verify_snapshot","process":"preview","result":"dump-ledger-integrity-fk-match","wall_us":100000},{"op":"apply_migration9","process":"preview","result":"schema9","wall_us":200000},{"op":"verify_migration9_idempotence","process":"preview","result":"schema9-unchanged","wall_us":300000},{"op":"accept","process":"api","wall_us":500000},{"op":"gate_acquire","process":"worker-a","wall_us":1500000},{"candidate":1,"fence":1,"op":"claim","process":"worker-a","wall_us":1600000},{"candidate":1,"fence":1,"op":"renew_start","process":"worker-a","wall_us":1700000},{"op":"socket_close","process":"worker-a","result":"matched","wall_us":2700000},{"fence":1,"op":"publish","process":"worker-a","result":"failure-before-commit","wall_us":2800000},{"op":"gate_release","process":"worker-a","wall_us":2900000},{"op":"restart","process":"worker-b","wall_us":16700000},{"op":"gate_acquire","process":"worker-b","wall_us":16800000},{"fence":2,"op":"recover","process":"worker-b","result":"interrupted","wall_us":16900000},{"candidate":2,"fence":2,"op":"claim","process":"worker-b","wall_us":17000000},{"candidate":2,"fence":2,"op":"renew_start","process":"worker-b","wall_us":17100000},{"op":"socket_close","process":"worker-b","result":"matched","wall_us":18100000},{"fence":2,"op":"publish","process":"worker-b","result":"matched","wall_us":18200000},{"op":"gate_release","process":"worker-b","wall_us":18300000},{"op":"read_current","process":"api","result":"reuse","wall_us":86418200000},{"op":"expire_current","process":"api","result":"stale","wall_us":86418200001}]}
